{"contractVersion":"1.0.0","correlationId":"00000000-0000-4000-8000-000000000001","causationId":null,"jobId":"00000000-0000-4000-8000-000000000301","attemptId":"00000000-0000-4000-8000-000000000401","messageType":"WORKER_REQUEST","sentAt":"2026-07-15T00:00:00.000Z","operation":"DOCUMENT_CONVERSION","provider":{"providerId":"reference.document","providerVersion":"1.0.0","adapterVersion":"1.0.0"},"policySnapshot":{"policyId":"00000000-0000-4000-8000-000000000201","policyVersion":"1.0.0","issuedAt":"2026-07-15T00:00:00.000Z","operation":"DOCUMENT_CONVERSION","allowedInputArtifactIds":["00000000-0000-4000-8000-000000000101"],"stagingPrefix":"staging/00000000-0000-4000-8000-000000000301/00000000-0000-4000-8000-000000000401","allowedOutputMediaTypes":["text/markdown"],"maxWallTimeMs":60000,"cancellationGraceMs":10000,"maxInputBytes":10485760,"maxOutputBytes":52428800,"maxArtifactBytes":52428800,"maxOutputArtifacts":100,"maxWarnings":100,"maxMemoryBytes":2147483648,"maxDiskBytes":1073741824,"networkMode":"DENY_ALL","allowExternalResources":false,"allowEmbeddedFiles":false,"maxEmbeddedFiles":0,"maxArchiveEntries":0,"maxArchiveDepth":0,"maxExpandedBytes":52428800,"maxCompressionRatio":100,"maxPages":1000,"maxRows":1000000,"maxColumns":10000},"payload":{"operation":"DOCUMENT_CONVERSION","inputArtifact":{"artifactId":"00000000-0000-4000-8000-000000000101","artifactClass":"RAW","role":"INPUT","key":"raw/sha256/aa/bb/aaaaaaaaaaaaaaaaaaaaaaaaaaaaaaaaaaaaaaaaaaaaaaaaaaaaaaaaaaaaaaaa/payload","mediaType":"application/pdf","byteLength":1024,"checksumAlgorithm":"SHA256","checksum":"aaaaaaaaaaaaaaaaaaaaaaaaaaaaaaaaaaaaaaaaaaaaaaaaaaaaaaaaaaaaaaaa","immutable":true,"createdAt":"2026-07-15T00:00:00.000Z"},"outputStagingPrefix":"staging/00000000-0000-4000-8000-000000000301/00000000-0000-4000-8000-000000000401","requestedOutputs":["MARKDOWN"],"documentProfile":"REPORT","ocrMode":"AUTO","languageHints":["ar","en"],"textDirectionHint":"MIXED","preserveLayout":true,"extractTables":true,"extractImages":false,"pageRange":null,"providerOptions":{}}}
